{
  "$schema": "https://json-schema.org/draft/2020-12/schema",
  "$id": "https://spec.agentngo.org/v1/community-hub.schema.json",
  "title": "Open Community Hub Specification (OCHS)",
  "description": "Standardized schema for physical civic sharing hubs, safe exchange zones, and mutual aid deposit centers.",
  "type": "object",
  "required": [
    "id",
    "name",
    "venueType",
    "location",
    "physicalExchangeCapacity",
    "verificationProtocol"
  ],
  "properties": {
    "$schema": {
      "type": "string"
    },
    "id": {
      "type": "string",
      "description": "Globally unique identifier for the community hub, preferably an OCHS URN (urn:ochs:hub:<country>:<municipality>:<slug>) or UUIDv4.",
      "pattern": "^(urn:ochs:hub:[a-z0-9-_]+:[a-z0-9-_]+:[a-z0-9-_]+|[0-9a-fA-F]{8}-[0-9a-fA-F]{4}-[0-9a-fA-F]{4}-[0-9a-fA-F]{4}-[0-9a-fA-F]{12}|sz-[a-z0-9-_]+)$"
    },
    "name": {
      "type": "string",
      "minLength": 2,
      "maxLength": 150,
      "description": "Official or primary community venue name."
    },
    "alternateNames": {
      "type": "array",
      "items": {
        "type": "string"
      },
      "description": "Alternative, translated, or colloquial names for the hub."
    },
    "description": {
      "type": "string",
      "maxLength": 1000,
      "description": "Detailed description of the exchange hub, ambient lighting, designated shelves, and public atmosphere."
    },
    "venueType": {
      "type": "string",
      "enum": [
        "library",
        "civic_center",
        "community_hall",
        "public_cafe",
        "community_space",
        "tool_library",
        "makerspace",
        "educational_facility",
        "neighborhood_pantry",
        "cultural_center"
      ],
      "description": "Classification of the physical venue."
    },
    "location": {
      "type": "object",
      "description": "Geographical location compliant with GeoJSON Point (RFC 7946) plus human postal address attributes.",
      "required": [
        "type",
        "coordinates",
        "address",
        "municipality",
        "countryCode"
      ],
      "properties": {
        "type": {
          "type": "string",
          "const": "Point",
          "description": "GeoJSON geometry type, must be 'Point'."
        },
        "coordinates": {
          "type": "array",
          "description": "WGS 84 coordinates in [longitude, latitude] order as specified by RFC 7946 GeoJSON standard.",
          "minItems": 2,
          "maxItems": 3,
          "items": {
            "type": "number"
          }
        },
        "latitude": {
          "type": "number",
          "minimum": -90,
          "maximum": 90,
          "description": "Convenience attribute for latitude in decimal degrees (-90 to +90)."
        },
        "longitude": {
          "type": "number",
          "minimum": -180,
          "maximum": 180,
          "description": "Convenience attribute for longitude in decimal degrees (-180 to +180)."
        },
        "address": {
          "type": "string",
          "description": "Street address line (e.g., 'Tryggvagata 15')."
        },
        "postalCode": {
          "type": "string",
          "description": "Postal or ZIP code (e.g., '101')."
        },
        "neighborhood": {
          "type": "string",
          "description": "Hyperlocal neighborhood, quarter, or sub-district name (e.g., 'Downtown / Kvosin', 'Vesturbær')."
        },
        "district": {
          "type": "string",
          "description": "Administrative district or municipal borough."
        },
        "municipality": {
          "type": "string",
          "description": "City or municipality name (e.g., 'Reykjavík')."
        },
        "countryCode": {
          "type": "string",
          "pattern": "^[A-Z]{2}$",
          "description": "ISO 3166-1 alpha-2 two-letter uppercase country code (e.g., 'IS')."
        }
      }
    },
    "operatingHours": {
      "type": "object",
      "description": "Operating schedule for the hub.",
      "required": [
        "display"
      ],
      "properties": {
        "display": {
          "type": "string",
          "description": "Human-readable schedule string (e.g., 'Mon-Thu 10:00 - 19:00, Fri 11:00 - 18:00, Sat-Sun 13:00 - 17:00')."
        },
        "osmOpeningHours": {
          "type": "string",
          "description": "Standard OpenStreetMap opening_hours syntax string (e.g., 'Mo-Th 10:00-19:00; Fr 11:00-18:00; Sa-Su 13:00-17:00')."
        },
        "timezone": {
          "type": "string",
          "description": "IANA Timezone identifier (e.g., 'Atlantic/Reykjavik', 'Europe/Berlin')."
        },
        "is24_7": {
          "type": "boolean",
          "default": false,
          "description": "Indicates whether the physical venue or exchange shelf is accessible 24 hours a day, 7 days a week."
        },
        "weeklySchedule": {
          "type": "array",
          "items": {
            "type": "object",
            "required": ["dayOfWeek", "opens", "closes"],
            "properties": {
              "dayOfWeek": {
                "type": "string",
                "enum": ["monday", "tuesday", "wednesday", "thursday", "friday", "saturday", "sunday"]
              },
              "opens": {
                "type": "string",
                "pattern": "^([01]?[0-9]|2[0-3]):[0-5][0-9]$"
              },
              "closes": {
                "type": "string",
                "pattern": "^([01]?[0-9]|2[0-3]):[0-5][0-9]$"
              }
            }
          }
        }
      }
    },
    "physicalExchangeCapacity": {
      "type": "object",
      "description": "Physical capacity and storage constraints for item handovers and unattended deposits.",
      "required": [
        "storageTier",
        "acceptsPerishables"
      ],
      "properties": {
        "storageTier": {
          "type": "string",
          "enum": [
            "direct_handover_only",
            "designated_shelf",
            "secure_locker",
            "dedicated_room",
            "community_depot"
          ],
          "description": "Physical infrastructure tier available for holding items."
        },
        "maxItemDimensionsCm": {
          "type": "object",
          "properties": {
            "length": { "type": "number", "minimum": 0 },
            "width": { "type": "number", "minimum": 0 },
            "height": { "type": "number", "minimum": 0 }
          },
          "description": "Maximum physical package dimensions in centimeters."
        },
        "maxWeightKg": {
          "type": "number",
          "minimum": 0,
          "description": "Maximum item weight accommodated in kilograms."
        },
        "maxHoldDurationHours": {
          "type": "integer",
          "minimum": 1,
          "description": "Maximum time an item can remain on shelf or in locker before collection or community redistribution (default: 72 hours)."
        },
        "acceptsPerishables": {
          "type": "boolean",
          "description": "Whether the hub accepts perishable food surplus."
        },
        "refrigerationAvailable": {
          "type": "boolean",
          "description": "Whether community food safe refrigeration is installed on premise."
        }
      }
    },
    "verificationProtocol": {
      "type": "object",
      "description": "Civic verification, staffing, lighting score, and cryptographic anchor details.",
      "required": [
        "tier",
        "lightingScore",
        "isStaffed"
      ],
      "properties": {
        "tier": {
          "type": "string",
          "enum": [
            "unverified",
            "community_attested",
            "partner_endorsed",
            "municipal_verified",
            "cryptographically_anchored"
          ],
          "description": "Verification maturity tier of the hub."
        },
        "lightingScore": {
          "type": "integer",
          "minimum": 1,
          "maximum": 5,
          "description": "Physical visibility and ambient lighting score on a scale from 1 (dim/obscure) to 5 (bright, monitored, highly visible civic atrium)."
        },
        "isStaffed": {
          "type": "boolean",
          "description": "Whether civic or organizational staff are on duty during operating hours."
        },
        "verificationHash": {
          "type": "string",
          "pattern": "^0x[0-9a-fA-F]{64}$",
          "description": "SHA-256 cryptographic attestation hash anchoring the hub coordinates and operating terms to a public ledger or merkle cycle."
        },
        "verifierIdentity": {
          "type": "string",
          "description": "Public name or DID of the verifying organization, municipal office, or civic body."
        },
        "verifiedAt": {
          "type": "string",
          "format": "date-time",
          "description": "ISO 8601 timestamp when verification was last audited."
        },
        "trustScore": {
          "type": "number",
          "minimum": 0,
          "maximum": 5,
          "description": "Aggregated community trust rating (0.0 to 5.0)."
        },
        "activeIssueCount": {
          "type": "integer",
          "minimum": 0,
          "default": 0,
          "description": "Number of open crowd-reported issues (e.g., temporary closure, shelf overload, reduced lighting)."
        }
      }
    },
    "accessibility": {
      "type": "object",
      "description": "Physical and social accessibility features.",
      "properties": {
        "isIndoor": {
          "type": "boolean",
          "description": "Whether the exchange area is sheltered indoors."
        },
        "isStepFree": {
          "type": "boolean",
          "description": "Step-free street entrance without stairs."
        },
        "wheelchairAccessible": {
          "type": "string",
          "enum": ["yes", "no", "limited", "designated"],
          "description": "OpenStreetMap wheelchair accessibility alignment tag."
        },
        "weekendAccessible": {
          "type": "boolean",
          "description": "Accessible on Saturdays or Sundays."
        },
        "publicRestroom": {
          "type": "boolean",
          "description": "Accessible public restrooms available on site."
        },
        "publicWifi": {
          "type": "boolean",
          "description": "Public community Wi-Fi accessible to neighbors."
        },
        "transitNearby": {
          "type": "array",
          "items": { "type": "string" },
          "description": "Names of nearest bus stops, tram stations, or transit lines (e.g., 'Strætó lines 1, 3, 6, 11, 14 at Lækjartorg')."
        }
      }
    },
    "osmAlignment": {
      "type": "object",
      "description": "OpenStreetMap mapping keys and entity cross-reference.",
      "properties": {
        "osmId": {
          "type": "string",
          "pattern": "^(node|way|relation)/[0-9]+$",
          "description": "OSM element identifier (e.g., 'node/438831920')."
        },
        "osmTags": {
          "type": "object",
          "additionalProperties": {
            "type": "string"
          },
          "description": "Key-value mapping of standard OSM tags (e.g., 'amenity': 'library', 'opening_hours': '...')."
        },
        "wikidataId": {
          "type": "string",
          "pattern": "^Q[0-9]+$",
          "description": "Wikidata item identifier (e.g., 'Q1234567')."
        }
      }
    },
    "contact": {
      "type": "object",
      "description": "Contact and public inquiries information.",
      "properties": {
        "website": {
          "type": "string",
          "format": "uri"
        },
        "phone": {
          "type": "string"
        },
        "email": {
          "type": "string",
          "format": "email"
        }
      }
    }
  },
  "additionalProperties": true
}
